{
  "report_version": "1.0",
  "catalog_version": "0.11.0",
  "generated_at": "2026-08-16T11:42:08Z",
  "subject": {
    "name": "invoice-classifier",
    "version": "a3f19c2",
    "archetypes": [
      "A1",
      "A2"
    ],
    "description": "Illustrative only. Batch document classifier that emits a typed record per invoice. Not a real system — the Phase 4 reference implementation replaces this with a report from a live repository's CI.",
    "repository": "https://github.com/example/invoice-classifier"
  },
  "results": [
    {
      "case": "AAC-0001",
      "status": "covered",
      "outcome": "pass",
      "mechanisms": [
        "M3"
      ],
      "stages": [
        "S3"
      ],
      "evidence": [
        {
          "type": "experiment",
          "ref": "golden set — 240 labelled invoices across 6 vendors",
          "url": "https://evals.example.internal/runs/a3f19c2"
        }
      ]
    },
    {
      "case": "AAC-0002",
      "status": "covered",
      "outcome": "pass",
      "mechanisms": [
        "M1"
      ],
      "stages": [
        "S2"
      ],
      "evidence": [
        {
          "type": "test",
          "ref": "tests.contract::test_response_matches_declared_schema"
        }
      ]
    },
    {
      "case": "AAC-0003",
      "status": "covered",
      "outcome": "pass",
      "mechanisms": [
        "M3"
      ],
      "stages": [
        "S3"
      ],
      "evidence": [
        {
          "type": "experiment",
          "ref": "declared constraints: output language, no commentary, refuse non-invoices",
          "url": "https://evals.example.internal/runs/a3f19c2"
        }
      ]
    },
    {
      "case": "AAC-0004",
      "status": "covered",
      "outcome": "pass",
      "mechanisms": [
        "M3"
      ],
      "stages": [
        "S3"
      ],
      "evidence": [
        {
          "type": "experiment",
          "ref": "instruction-override attempts embedded in document text",
          "url": "https://evals.example.internal/runs/a3f19c2"
        }
      ]
    },
    {
      "case": "AAC-0005",
      "status": "accepted-risk",
      "owner": "platform-security",
      "rationale": "The adversarial safety corpus is maintained centrally and is not yet wired into this pipeline. Inputs are internal invoice documents, so exposure is limited until the classifier accepts external submissions.",
      "review_by": "2026-11-30"
    },
    {
      "case": "AAC-0006",
      "status": "covered",
      "outcome": "pass",
      "mechanisms": [
        "M1"
      ],
      "stages": [
        "S2",
        "S4"
      ],
      "evidence": [
        {
          "type": "test",
          "ref": "tests.gateway::test_output_scan_blocks_personal_data"
        }
      ]
    },
    {
      "case": "AAC-0007",
      "status": "not-covered"
    },
    {
      "case": "AAC-0008",
      "status": "not-covered"
    },
    {
      "case": "AAC-0009",
      "status": "covered",
      "outcome": "pass",
      "mechanisms": [
        "M1"
      ],
      "stages": [
        "S2"
      ],
      "evidence": [
        {
          "type": "test",
          "ref": "tests.resilience::test_rate_limit_and_timeout_fall_back"
        }
      ]
    },
    {
      "case": "AAC-0010",
      "status": "not-covered"
    },
    {
      "case": "AAC-0011",
      "status": "covered",
      "outcome": "pass",
      "mechanisms": [
        "M5"
      ],
      "stages": [
        "S2"
      ],
      "evidence": [
        {
          "type": "test",
          "ref": "tests.telemetry::test_span_carries_required_attributes"
        }
      ]
    },
    {
      "case": "AAC-0012",
      "status": "covered",
      "outcome": "pass",
      "mechanisms": [
        "M5"
      ],
      "stages": [
        "S2"
      ],
      "evidence": [
        {
          "type": "test",
          "ref": "tests.telemetry::test_model_and_prompt_version_recorded"
        }
      ]
    },
    {
      "case": "AAC-0013",
      "status": "covered",
      "outcome": "pass",
      "mechanisms": [
        "M3"
      ],
      "stages": [
        "S3"
      ],
      "evidence": [
        {
          "type": "experiment",
          "ref": "candidate vs incumbent on the frozen set, per-case win/loss/tie",
          "url": "https://evals.example.internal/runs/a3f19c2"
        }
      ]
    },
    {
      "case": "AAC-0014",
      "status": "not-covered"
    },
    {
      "case": "AAC-0015",
      "status": "covered",
      "outcome": "pass",
      "mechanisms": [
        "M1"
      ],
      "stages": [
        "S2"
      ],
      "evidence": [
        {
          "type": "test",
          "ref": "tests.resilience::test_empty_and_garbage_input"
        }
      ]
    },
    {
      "case": "AAC-0016",
      "status": "accepted-risk",
      "owner": "ml-platform",
      "rationale": "Scheduled drift re-runs await the shared eval scheduler landing in Q4. The pinned model version limits provider-side drift in the interim.",
      "review_by": "2026-12-15"
    },
    {
      "case": "AAC-0017",
      "status": "covered",
      "outcome": "pass",
      "mechanisms": [
        "M3"
      ],
      "stages": [
        "S3"
      ],
      "evidence": [
        {
          "type": "experiment",
          "ref": "accuracy by vendor, document length band and source channel",
          "url": "https://evals.example.internal/runs/a3f19c2"
        }
      ]
    },
    {
      "case": "AAC-0018",
      "status": "covered",
      "outcome": "pass",
      "mechanisms": [
        "M3"
      ],
      "stages": [
        "S3"
      ],
      "evidence": [
        {
          "type": "experiment",
          "ref": "semantically equivalent rewrites and reordered line items",
          "url": "https://evals.example.internal/runs/a3f19c2"
        }
      ]
    },
    {
      "case": "AAC-0019",
      "status": "covered",
      "outcome": "pass",
      "mechanisms": [
        "M1"
      ],
      "stages": [
        "S2"
      ],
      "evidence": [
        {
          "type": "test",
          "ref": "tests.resilience::test_oversized_document_is_chunked_not_truncated"
        }
      ]
    },
    {
      "case": "AAC-0020",
      "status": "covered",
      "outcome": "pass",
      "mechanisms": [
        "M3"
      ],
      "stages": [
        "S3"
      ],
      "evidence": [
        {
          "type": "experiment",
          "ref": "legitimate invoices resembling policy violations are not refused",
          "url": "https://evals.example.internal/runs/a3f19c2"
        }
      ]
    },
    {
      "case": "AAC-0021",
      "status": "not-covered"
    },
    {
      "case": "AAC-0022",
      "status": "covered",
      "outcome": "pass",
      "mechanisms": [
        "M1"
      ],
      "stages": [
        "S2"
      ],
      "evidence": [
        {
          "type": "test",
          "ref": "tests.contract::test_every_field_validates"
        }
      ]
    },
    {
      "case": "AAC-0023",
      "status": "covered",
      "outcome": "fail",
      "mechanisms": [
        "M1"
      ],
      "stages": [
        "S2"
      ],
      "evidence": [
        {
          "type": "test",
          "ref": "tests.contract::test_dates_and_currency_normalise"
        }
      ],
      "note": "3 of 40 gold records normalised to the wrong locale: 04/07/2026 parsed as 7 April, expected 4 July"
    },
    {
      "case": "AAC-0024",
      "status": "covered",
      "outcome": "pass",
      "mechanisms": [
        "M1"
      ],
      "stages": [
        "S2"
      ],
      "evidence": [
        {
          "type": "test",
          "ref": "tests.contract::test_missing_fields_are_null_not_invented"
        }
      ]
    },
    {
      "case": "AAC-0025",
      "status": "covered",
      "outcome": "pass",
      "mechanisms": [
        "M3"
      ],
      "stages": [
        "S3"
      ],
      "evidence": [
        {
          "type": "experiment",
          "ref": "precision and recall reported per field, not per record",
          "url": "https://evals.example.internal/runs/a3f19c2"
        }
      ]
    },
    {
      "case": "AAC-0026",
      "status": "covered",
      "outcome": "pass",
      "mechanisms": [
        "M1"
      ],
      "stages": [
        "S2"
      ],
      "evidence": [
        {
          "type": "test",
          "ref": "tests.contract::test_added_optional_field_keeps_consumer_working"
        }
      ]
    },
    {
      "case": "AAC-0027",
      "status": "covered",
      "outcome": "pass",
      "mechanisms": [
        "M1"
      ],
      "stages": [
        "S2"
      ],
      "evidence": [
        {
          "type": "test",
          "ref": "tests.contract::test_downstream_ingest_on_recorded_responses"
        }
      ]
    },
    {
      "case": "AAC-0091",
      "status": "covered",
      "outcome": "pass",
      "mechanisms": [
        "M1"
      ],
      "stages": [
        "S2",
        "S4"
      ],
      "evidence": [
        {
          "type": "test",
          "ref": "tests.gateway::test_guardrail_outage_fails_closed"
        }
      ]
    },
    {
      "case": "AAC-0092",
      "status": "not-applicable",
      "rationale": "Responses are not streamed; classification returns a single structured object per document."
    },
    {
      "case": "AAC-0093",
      "status": "covered",
      "outcome": "pass",
      "mechanisms": [
        "M1"
      ],
      "stages": [
        "S2",
        "S4"
      ],
      "evidence": [
        {
          "type": "test",
          "ref": "tests.gateway::test_tenant_quota_rejects_over_ceiling"
        }
      ]
    },
    {
      "case": "AAC-0094",
      "status": "covered",
      "outcome": "pass",
      "mechanisms": [
        "M1"
      ],
      "stages": [
        "S2",
        "S4"
      ],
      "evidence": [
        {
          "type": "test",
          "ref": "tests.gateway::test_unapproved_model_call_is_refused"
        }
      ]
    },
    {
      "case": "AAC-0095",
      "status": "covered",